{
  "$schema": "https://json-schema.org/draft/2020-12/schema",
  "$id": "https://wulfquest.invalid/schema/input.schema.json",
  "title": "config/input.json — AGENTS.md §19",
  "type": "object",
  "additionalProperties": false,
  "required": ["schemaVersion", "active", "menuSelect", "profiles", "gamepad"],
  "properties": {
    "schemaVersion": { "type": "integer", "minimum": 1 },
    "active": { "type": "string", "minLength": 1 },
    "menuSelect": {
      "description": "Keys that choose a line on every menu page, whichever profile is active, as well as that profile's fire (§19.1).",
      "type": "array", "minItems": 1, "uniqueItems": true,
      "items": { "type": "string", "pattern": "^([A-Z]|[0-9]|UP|DOWN|LEFT|RIGHT|SPACE|ESCAPE|ENTER|TAB|BACKSPACE)$" }
    },
    "profiles": {
      "type": "object",
      "minProperties": 1,
      "additionalProperties": {
        "type": "object",
        "additionalProperties": false,
        "required": ["up", "down", "left", "right", "fire", "pause", "quit", "devKill", "devMask", "devWulf"],
        "patternProperties": {
          "^(up|down|left|right|fire|pause|quit|devKill|devMask|devWulf)$": {
            "type": "array", "minItems": 1, "uniqueItems": true,
            "items": { "type": "string", "pattern": "^([A-Z]|[0-9]|UP|DOWN|LEFT|RIGHT|SPACE|ESCAPE|ENTER|TAB|BACKSPACE)$" }
          }
        }
      }
    },
    "gamepad": {
      "type": "object", "additionalProperties": false,
      "required": ["enabled", "deadzonePercent", "dpadAsDirections", "buttons"],
      "properties": {
        "enabled": { "type": "boolean" },
        "deadzonePercent": { "type": "integer", "minimum": 0, "maximum": 99 },
        "dpadAsDirections": { "type": "boolean" },
        "buttons": {
          "type": "object",
          "additionalProperties": false,
          "required": ["fire", "pause", "quit", "map", "newGame", "difficulty"],
          "patternProperties": {
            "^(fire|pause|quit|map|newGame|difficulty)$": {
              "type": "array", "minItems": 1, "uniqueItems": true,
              "items": { "enum": ["A", "B", "X", "Y", "BACK", "START", "LEFTBUMPER", "RIGHTBUMPER", "LEFTSTICK", "RIGHTSTICK"] }
            }
          }
        }
      }
    }
  }
}
