{
  "schemaVersion": 1,
  "active": "modern",
  "menuSelect": ["SPACE", "ENTER"],
  "profiles": {
    "modern": {
      "up": ["UP", "W"],
      "down": ["DOWN", "S"],
      "left": ["LEFT", "A"],
      "right": ["RIGHT", "D"],
      "fire": ["SPACE", "Z"],
      "pause": ["P"],
      "quit": ["ESCAPE"],
      "devKill": ["K"],
      "devMask": ["N"],
      "devWulf": ["H"]
    },
    "period": {
      "up": ["Q"],
      "down": ["A"],
      "left": ["O"],
      "right": ["P"],
      "fire": ["M"],
      "pause": ["H"],
      "quit": ["ESCAPE"],
      "devKill": ["K"],
      "devMask": ["N"],
      "devWulf": ["J"]
    }
  },
  "gamepad": {
    "enabled": true,
    "deadzonePercent": 40,
    "dpadAsDirections": true,
    "buttons": {
      "fire": ["A", "X"],
      "pause": ["START"],
      "quit": ["BACK"],
      "map": ["Y"],
      "newGame": ["Y"],
      "difficulty": ["B"]
    }
  }
}
